<!--
    Copyright 2009 Brad Christie

    This file is part of TAMinations.

    TAMinations is free software: you can redistribute it and/or modify
    it under the terms of the GNU Affero General Public License as published
    by the Free Software Foundation, either version 3 of the License, or
    (at your option) any later version.

    TAMinations is distributed in the hope that it will be useful,
    but WITHOUT ANY WARRANTY; without even the implied warranty of
    MERCHANTABILITY or FITNESS FOR A PARTICULAR PURPOSE.  See the
    GNU Affero General Public License for more details.

    You should have received a copy of the GNU Affero General Public License
    along with TAMinations.  If not, see <http://www.gnu.org/licenses/>.
-->

<!ENTITY deg    "&#176;" ><!--=degree sign-->
<!ENTITY frac12 "&#189;" ><!--=fraction one-half-->
<!ENTITY frac14 "&#188;" ><!--=fraction one-quarter-->
<!ENTITY frac34 "&#190;" ><!--=fraction three-quarters-->
<!ENTITY mdash  "&#x2014;" ><!--=em dash-->
<!ENTITY ndash  "&#x2013;" ><!--=en dash-->
<!ENTITY middot "&#183;" ><!--/centerdot B: =middle dot-->
<!ENTITY bull   "&#x2022;" ><!--/bullet B: =round bullet, filled-->

<!ELEMENT tamination (title?,definition?,styling?,timing?,comment?,(calllist|tam*))>

<!ELEMENT title ANY>
<!ATTLIST title  level CDATA #REQUIRED>

<!ELEMENT definition ANY>

<!ELEMENT timing ANY>

<!ELEMENT styling ANY>

<!ELEMENT comment ANY>

<!ELEMENT tam (path+,taminator?)>
<!ATTLIST tam title CDATA #REQUIRED
              group CDATA #IMPLIED
              from CDATA #IMPLIED
              formation CDATA #REQUIRED
              parts CDATA #IMPLIED
              difficulty CDATA #IMPLIED
              gender-specific CDATA #IMPLIED >

<!ELEMENT taminator ANY>

<!ELEMENT path (move | Movement)* >
<!ATTLIST path numbers CDATA #IMPLIED >

<!ELEMENT move EMPTY>
<!ATTLIST move select CDATA #REQUIRED
               beats CDATA #IMPLIED
               hands CDATA #IMPLIED
               reflect CDATA #IMPLIED
               scaleX CDATA #IMPLIED
               scaleY CDATA #IMPLIED
               offsetX CDATA #IMPLIED
               offsetY CDATA #IMPLIED >

<!ELEMENT Movement EMPTY>
<!ATTLIST Movement hands CDATA #REQUIRED
                   beats CDATA #REQUIRED
                   style CDATA #IMPLIED
                   cx1 CDATA #REQUIRED
                   cy1 CDATA #REQUIRED
                   cx2 CDATA #REQUIRED
                   cy2 CDATA #REQUIRED
                   x2 CDATA #REQUIRED
                   y2 CDATA #REQUIRED
                   cx3 CDATA #IMPLIED
                   cx4 CDATA #IMPLIED
                   cy4 CDATA #IMPLIED
                   x4 CDATA #IMPLIED
                   y4 CDATA #IMPLIED >

<!ELEMENT calllist (calldate*)>
<!ATTLIST calllist title CDATA #REQUIRED>
<!ELEMENT calldate (call+)>
<!ATTLIST calldate date CDATA #REQUIRED>
<!ELEMENT call EMPTY>
<!ATTLIST call name CDATA #REQUIRED
               href CDATA #REQUIRED>
