<?xml version="1.0"?>
<!DOCTYPE tamination SYSTEM "../tamination.dtd">
<!--

    Copyright 2012 Brad Christie

    This file is part of TAMinations.

    TAMinations is free software: you can redistribute it and/or modify
    it under the terms of the GNU Affero General Public License as published
    by the Free Software Foundation, either version 3 of the License, or
    (at your option) any later version.

    TAMinations is distributed in the hope that it will be useful,
    but WITHOUT ANY WARRANTY; without even the implied warranty of
    MERCHANTABILITY or FITNESS FOR A PARTICULAR PURPOSE.  See the
    GNU Affero General Public License for more details.

    You should have received a copy of the GNU Affero General Public License
    along with TAMinations.  If not, see <http://www.gnu.org/licenses/>.

-->
<tamination>

  <tam title="Extend" from="Right-Hand Wave" formation="Wave RH" difficulty="1">
    <path>
      <move select="Extend Right" beats="2" scaleX="2" scaleY="2"/>
    </path>
    <path>
      <move select="Forward 2"/>
    </path>
  </tam>

  <tam title="Extend"
       from="Right-Hand 1/4 Tag"
       formation="Quarter Tag"
       parts="" difficulty="1">
    <path>
      <move select="Extend Left" scaleY="2" beats="2" />
    </path>
    <path>
      <move select="Forward" beats="2" />
    </path>
    <path>
      <move select="Forward 2" />
    </path>
    <path>
      <move select="Forward 2" />
    </path>
  </tam>

  <tam title="Extend"
       from="Left-Hand 1/4 Tag"
       formation="Quarter Tag LH"
       parts="" difficulty="2">
    <path>
      <move select="Forward" beats="2" />
    </path>
    <path>
      <move select="Extend Right" scaleY="2" beats="2" />
    </path>
    <path>
      <move select="Forward 2" />
    </path>
    <path>
      <move select="Forward 2" />
    </path>
  </tam>

  <tam title="Extend"
       from="Double Pass Thru"
       formation="Double Pass Thru"
       parts="" difficulty="1">
    <path>
    </path>
    <path>
    </path>
    <path>
      <move select="Extend Left" beats="2" scaleY="2" />
    </path>
    <path>
      <move select="Forward" beats="2" />
    </path>
  </tam>

  <tam title="Extend"
       from="Ocean Waves"
       formation="Ocean Waves RH BGGB"
       parts="" difficulty="1">
    <path>
      <move select="Forward 2" />
    </path>
    <path>
      <move select="Forward" />
    </path>
    <path>
      <move select="Forward 2" />
    </path>
    <path>
      <move select="Extend Right" scaleY="2" beats="2" />
    </path>
  </tam>

  <tam title="Extend"
       from="3/4 Tag"
       formation="3/4 Tag"
       parts="" difficulty="1">
    <path>
    </path>
    <path>
    </path>
    <path>
      <move select="Extend Right" beats="2" scaleY="2" />
    </path>
    <path>
      <move select="Forward" beats="2" />
    </path>
  </tam>
</tamination>
