<?xml version="1.0"?>
<!DOCTYPE tamination SYSTEM "../tamination.dtd">
<!--

    Copyright 2012 Brad Christie

    This file is part of TAMinations.

    TAMinations is free software: you can redistribute it and/or modify
    it under the terms of the GNU Affero General Public License as published
    by the Free Software Foundation, either version 3 of the License, or
    (at your option) any later version.

    TAMinations is distributed in the hope that it will be useful,
    but WITHOUT ANY WARRANTY; without even the implied warranty of
    MERCHANTABILITY or FITNESS FOR A PARTICULAR PURPOSE.  See the
    GNU Affero General Public License for more details.

    You should have received a copy of the GNU Affero General Public License
    along with TAMinations.  If not, see <http://www.gnu.org/licenses/>.

-->
<tamination>
  
  

  <tam title="3 By 1 Transfer the Column"
       from="Right-Hand Columns"
       formation="Formation girl -3 -1 180 boy 1 -1 180 girl -1 -1 180 boy 3 -1 180"
       parts="" >
    <path>
      <move select="Run Right" beats="3" scaleY="2" />
      <move select="Forward 4" />
      <move select="Lead Right" beats="2.5" scaleX="2" />
    </path>
    <path>
      <move select="Forward 2" />
      <move select="Forward 2" />
      <move select="Run Right" beats="4" scaleY="2" offsetX="1" />
      <move select="Lead Right" />
    </path>
    <path>
      <move select="Forward 2" />
      <move select="Run Right" beats="3" scaleY="2" />
      <move select="Lead Right" beats="4.5" scaleX="4" />
    </path>
    <path>
      <move select="Forward 2" />
      <move select="Forward" />
      <move select="Cast Right" />
      <move select="Forward 2" />
    </path>
  </tam>

  <tam title="3 By 1 Transfer the Column"
       from="Left-Hand Columns"
       formation="Formation girl 3 -1 0 boy -1 -1 0 girl 1 -1 0 boy -3 -1 0"
       parts="" >
    <path>
      <move select="Run Left" beats="3" scaleY="2" />
      <move select="Forward 4" />
      <move select="Lead Left" beats="2.5" scaleX="2" />
    </path>
    <path>
      <move select="Forward 2" />
      <move select="Forward 2" />
      <move select="Run Left" beats="4" scaleY="2" offsetX="1" />
      <move select="Lead Left" />
    </path>
    <path>
      <move select="Forward 2" />
      <move select="Run Left" beats="3" scaleY="2" />
      <move select="Lead Left" beats="4.5" scaleX="4" />
    </path>
    <path>
      <move select="Forward 2" />
      <move select="Forward" />
      <move select="Cast Left" />
      <move select="Forward 2" />
    </path>
  </tam>
</tamination>
