<?xml version="1.0"?>
<!DOCTYPE tamination SYSTEM "../tamination.dtd">
<!--

    Copyright 2012 Brad Christie

    This file is part of TAMinations.

    TAMinations is free software: you can redistribute it and/or modify
    it under the terms of the GNU Affero General Public License as published
    by the Free Software Foundation, either version 3 of the License, or
    (at your option) any later version.

    TAMinations is distributed in the hope that it will be useful,
    but WITHOUT ANY WARRANTY; without even the implied warranty of
    MERCHANTABILITY or FITNESS FOR A PARTICULAR PURPOSE.  See the
    GNU Affero General Public License for more details.

    You should have received a copy of the GNU Affero General Public License
    along with TAMinations.  If not, see <http://www.gnu.org/licenses/>.

-->
<tamination>
  
  
  
  

  <tam title="Turn Thru"
       from="Facing Couples"
       formation="Facing Couples"
       parts="" >
    <path>
      <move select="Extend Left" scaleX="2" scaleY=".5" />
      <move select="Swing Right" hands="gripright" beats="2" scaleX=".5" scaleY=".5" />
      <move select="Extend Right" scaleX="2" scaleY=".5" />
    </path>
    <path>
      <move select="Extend Left" scaleX="2" scaleY=".5" />
      <move select="Swing Right" hands="gripright" beats="2" scaleX=".5" scaleY=".5" />
      <move select="Extend Right" scaleX="2" scaleY=".5" />
    </path>
  </tam>

  <tam title="Turn Thru"
       from="Lines"
       formation="Normal Lines"
       parts="" >
    <path>
      <move select="Extend Left" beats="2" scaleX="2" scaleY=".5" />
      <move select="Swing Right" hands="gripright" beats="2" scaleX=".5" scaleY=".5" />
      <move select="Extend Right" beats="2" scaleX="2" scaleY=".5" />
    </path>
    <path>
      <move select="Extend Left" beats="2" scaleX="2" scaleY=".5" />
      <move select="Swing Right" hands="gripright" beats="2" scaleX=".5" scaleY=".5" />
      <move select="Extend Right" beats="2" scaleX="2" scaleY=".5" />
    </path>
    <path>
      <move select="Extend Left" beats="2" scaleX="2" scaleY=".5" />
      <move select="Swing Right" hands="gripright" beats="2" scaleX=".5" scaleY=".5" />
      <move select="Extend Right" beats="2" scaleX="2" scaleY=".5" />
    </path>
    <path>
      <move select="Extend Left" beats="2" scaleX="2" scaleY=".5" />
      <move select="Swing Right" hands="gripright" beats="2" scaleX=".5" scaleY=".5" />
      <move select="Extend Right" beats="2" scaleX="2" scaleY=".5" />
    </path>
  </tam>

  <tam title="Turn Thru"
       from="Ocean Waves"
       formation="Ocean Waves RH BGGB"
       parts="" >
    <path>
      <move select="Hinge Right" scaleX=".75" />
      <move select="Hinge Right" scaleX=".75" scaleY=".75" />
      <move select="Extend Left" scaleY=".25" />
    </path>
    <path>
      <move select="Hinge Right" scaleX=".75" />
      <move select="Hinge Right" scaleX=".75" scaleY=".75" />
      <move select="Extend Right" beats="2" scaleY="1.75" />
    </path>
    <path>
      <move select="Hinge Right" scaleX=".75" />
      <move select="Hinge Right" scaleX=".75" scaleY=".75" />
      <move select="Extend Right" beats="2" scaleY="1.75" />
    </path>
    <path>
      <move select="Hinge Right" scaleX=".75" />
      <move select="Hinge Right" scaleX=".75" scaleY=".75" />
      <move select="Extend Left" scaleY=".25" />
    </path>
  </tam>
</tamination>
