<?xml version="1.0"?>
<!DOCTYPE tamination SYSTEM "../tamination.dtd">
<!--

    Copyright 2012 Brad Christie

    This file is part of TAMinations.

    TAMinations is free software: you can redistribute it and/or modify
    it under the terms of the GNU Affero General Public License as published
    by the Free Software Foundation, either version 3 of the License, or
    (at your option) any later version.

    TAMinations is distributed in the hope that it will be useful,
    but WITHOUT ANY WARRANTY; without even the implied warranty of
    MERCHANTABILITY or FITNESS FOR A PARTICULAR PURPOSE.  See the
    GNU Affero General Public License for more details.

    You should have received a copy of the GNU Affero General Public License
    along with TAMinations.  If not, see <http://www.gnu.org/licenses/>.

-->
<tamination>



  <tam title="Bias Circulate" from="Right-Hand Waves" formation="Ocean Waves RH BGBG">
    <path>
      <move select="Extend Right" beats="3" scaleX="2" scaleY="2"/>
      <move select="Hinge Right"/>
      <move select="Lead Left" beats="3"/>
    </path>
    <path>
      <move select="Run Left" beats="7.5"/>
    </path>
    <path>
      <move select="Lead Left" beats="3"/>
      <move select="Hinge Right"/>
      <move select="Extend Left" beats="3" scaleX="2" scaleY="2"/>
    </path>
    <path>
      <move select="Run Right" beats="7.5" scaleX="2" scaleY="3"/>
    </path>
  </tam>

  <tam title="Bias Circulate" from="Left-Hand Waves" formation="Ocean Waves LH BGBG">
    <path>
      <move select="Run Left" beats="7.5" scaleX="2" scaleY="3"/>
    </path>
    <path>
      <move select="Lead Right" beats="3"/>
      <move select="Hinge Left"/>
      <move select="Extend Right" beats="3" scaleX="2" scaleY="2"/>
    </path>
    <path>
      <move select="Run Right" beats="7.5"/>
    </path>
    <path>
      <move select="Extend Left" beats="3" scaleX="2" scaleY="2"/>
      <move select="Hinge Left"/>
      <move select="Lead Right" beats="3"/>
    </path>
  </tam>

</tamination>
