<?xml version="1.0"?>
<!DOCTYPE tamination SYSTEM "../tamination.dtd">
<!--

    Copyright 2012 Brad Christie

    This file is part of TAMinations.

    TAMinations is free software: you can redistribute it and/or modify
    it under the terms of the GNU Affero General Public License as published
    by the Free Software Foundation, either version 3 of the License, or
    (at your option) any later version.

    TAMinations is distributed in the hope that it will be useful,
    but WITHOUT ANY WARRANTY; without even the implied warranty of
    MERCHANTABILITY or FITNESS FOR A PARTICULAR PURPOSE.  See the
    GNU Affero General Public License for more details.

    You should have received a copy of the GNU Affero General Public License
    along with TAMinations.  If not, see <http://www.gnu.org/licenses/>.

-->
<tamination>

  <tam title="Switch to an Interlocked Diamond"
       from="Right-Hand Waves"
       formation="Formation girl 3 2 270  boy 1 2 90  boy -1 2 270  girl -3 2 90">
    <path numbers="7 2">
      <move select="Lead Right" scaleX="3" scaleY="3" beats="3" />
    </path>
    <path numbers="5 4">
      <move select="Run Right" />
    </path>
    <path numbers="3 6">
      <move select="Run Right" />
    </path>
    <path numbers="1 8">
      <move select="Lead Right" scaleY="3" beats="3" />
    </path>
  </tam>

  <tam title="Switch to an Interlocked Diamond"
       from="Left-Hand Waves"
       formation="Ocean Waves LH GBBG"
       parts="" >
    <path>
      <move select="Lead Left" scaleY="3" beats="3" />
    </path>
    <path>
      <move select="Run Left" />
    </path>
    <path>
      <move select="Run Left" />
    </path>
    <path>
      <move select="Lead Left" scaleX="3" scaleY="3" beats="3" />
    </path>
  </tam>

  <tam title="Switch to an Interlocked Diamond"
       from="Right-Hand Two-Faced Lines" formation="Two-Faced Lines RH">
    <path>
      <move select="Lead Right" scaleX="3" scaleY="3" beats="3" />
    </path>
    <path>
      <move select="Flip Left"/>
    </path>
    <path>
      <move select="Flip Left"/>
    </path>
    <path>
      <move select="Lead Right" scaleY="3" beats="3" />
    </path>
  </tam>

  <tam title="Switch to an Interlocked Diamond"
       from="Left-Hand Two-Faced Lines" formation="Two-Faced Lines LH">
    <path>
      <move select="Lead Left" scaleY="3" beats="3" />
    </path>
    <path>
      <move select="Flip Right"/>
    </path>
    <path>
      <move select="Flip Right"/>
    </path>
    <path>
      <move select="Lead Left" scaleX="3" scaleY="3" beats="3" />
    </path>
  </tam>

</tamination>
