<?xml version="1.0"?>
<!DOCTYPE tamination SYSTEM "../tamination.dtd">
<!--

    Copyright 2012 Brad Christie

    This file is part of TAMinations.

    TAMinations is free software: you can redistribute it and/or modify
    it under the terms of the GNU Affero General Public License as published
    by the Free Software Foundation, either version 3 of the License, or
    (at your option) any later version.

    TAMinations is distributed in the hope that it will be useful,
    but WITHOUT ANY WARRANTY; without even the implied warranty of
    MERCHANTABILITY or FITNESS FOR A PARTICULAR PURPOSE.  See the
    GNU Affero General Public License for more details.

    You should have received a copy of the GNU Affero General Public License
    along with TAMinations.  If not, see <http://www.gnu.org/licenses/>.

-->
<tamination>

  <tam title="3/4 Tag the Line"
       from="Right-Hand Two-Faced Line"
       formation="Two-Faced Line RH"
       parts="" difficulty="1">
    <path>
      <move select="Lead Right" scaleX=".5" />
      <move select="Extend Left" beats="3" scaleX="2" scaleY=".5" />
    </path>
    <path>
      <move select="Lead Right" scaleX=".5" />
      <move select="Forward" />
      <move select="Extend Right" beats="2" scaleX="2" scaleY=".5" />
    </path>
  </tam>

  <tam title="3/4 Tag the Line"
       from="Left-Hand Two-Faced Line"
       formation="Two-Faced Line LH"
       parts="" difficulty="2">
    <path>
      <move select="Quarter Left" offsetX="-.5" offsetY=".5" />
      <move select="Forward" />
      <move select="Extend Right" beats="2" scaleX="2.5" scaleY=".5" />
    </path>
    <path>
      <move select="Quarter Left" offsetX="-.5" offsetY=".5" />
      <move select="Extend Left" beats="3" scaleX="2.5" scaleY=".5" />
    </path>
  </tam>

  <tam title="3/4 Tag the Line"
       from="Right-Hand Wave"
       formation="Wave RH"
       parts="" difficulty="2">
    <path>
      <move select="Lead Right" scaleX=".5" />
      <move select="Extend Left" beats="3" scaleX="2" scaleY=".5" />
    </path>
    <path>
      <move select="Quarter Left" offsetX="-.5" offsetY=".5" />
      <move select="Forward" />
      <move select="Extend Right" beats="2" scaleX="2.5" scaleY=".5" />
    </path>
  </tam>

  <tam title="3/4 Tag the Line"
       from="Left-Hand Wave"
       formation="Wave LH"
       parts="" difficulty="1">
    <path>
      <move select="Quarter Left" offsetX="-.5" offsetY=".5" />
      <move select="Extend Left" beats="3" scaleX="2.5" scaleY=".5" />
    </path>
    <path>
      <move select="Lead Right" scaleX=".5" />
      <move select="Forward" />
      <move select="Extend Right" beats="2" scaleX="2" scaleY=".5" />
    </path>
  </tam>

  <tam title="3/4 Tag the Line"
       from="Right-Hand Two-Faced Lines"
       formation="Two-Faced Lines RH"
       parts="" difficulty="1">
    <path>
      <move select="Lead Right" scaleX=".5" />
      <move select="Extend Left" beats="3" scaleX="2" scaleY=".5" />
    </path>
    <path>
      <move select="Lead Right" scaleX=".5" />
      <move select="Extend Left" beats="3" scaleX="3" scaleY=".5" />
    </path>
    <path>
      <move select="Lead Right" scaleX=".5" />
      <move select="Forward" />
      <move select="Extend Right" beats="2" scaleX="2" scaleY="1.5" />
    </path>
    <path>
      <move select="Lead Right" scaleX=".5" />
      <move select="Extend Left" beats="3" scaleX="2" scaleY=".5" />
    </path>
  </tam>
</tamination>
