<?xml version="1.0"?>
<!DOCTYPE tamination SYSTEM "../tamination.dtd">
<!--

    Copyright 2012 Brad Christie

    This file is part of TAMinations.

    TAMinations is free software: you can redistribute it and/or modify
    it under the terms of the GNU Affero General Public License as published
    by the Free Software Foundation, either version 3 of the License, or
    (at your option) any later version.

    TAMinations is distributed in the hope that it will be useful,
    but WITHOUT ANY WARRANTY; without even the implied warranty of
    MERCHANTABILITY or FITNESS FOR A PARTICULAR PURPOSE.  See the
    GNU Affero General Public License for more details.

    You should have received a copy of the GNU Affero General Public License
    along with TAMinations.  If not, see <http://www.gnu.org/licenses/>.

-->
<tamination>

  <tam title="3/4 Mix" from="Right-Hand Box" formation="Box RH" parts="4.5;4">
    <path>
      <move select="Cast Right"/>
      <move select="Dodge Right" beats="4"/>
      <move select="Swing Right"/>
    </path>
    <path>
      <move select="Cast Right"/>
      <move select="Run Left" beats="4" scaleY="2"/>
    </path>
  </tam>

  <tam title="3/4 Mix" from="Right-Hand Waves" formation="Ocean Waves RH BGBG" parts="4.5;4">
    <path>
      <move select="Cast Right"/>
      <move select="Dodge Right" beats="4"/>
      <move select="Swing Right"/>
    </path>
    <path>
      <move select="Cast Right"/>
      <move select="Run Left" beats="4" scaleY="2"/>
    </path>
    <path>
      <move select="Cast Right"/>
      <move select="Dodge Right" beats="4"/>
      <move select="Swing Right"/>
    </path>
    <path>
      <move select="Cast Right"/>
      <move select="Run Left" beats="4" scaleY="2"/>
    </path>
  </tam>

  <tam title="3/4 Mix" from="Right-Hand Columns" formation="Column RH GBGB" parts="4.5;3">
    <path>
      <move select="Hinge Right" scaleX=".5"/>
      <move select="Swing Right" scaleX=".5" scaleY=".5"/>
      <move select="Run Left"/>
    </path>
    <path>
      <move select="Hinge Right" scaleX=".5"/>
      <move select="Swing Right" scaleX=".5" scaleY=".5"/>
      <move select="Dodge Right" scaleY=".5"/>
      <move select="Swing Right" scaleX=".5" scaleY=".5"/>
    </path>
    <path>
      <move select="Hinge Right" scaleX=".5"/>
      <move select="Swing Right" scaleX=".5" scaleY=".5"/>
      <move select="Run Left"/>
    </path>
    <path>
      <move select="Hinge Right" scaleX=".5"/>
      <move select="Swing Right" scaleX=".5" scaleY=".5"/>
      <move select="Dodge Right" scaleY=".5"/>
      <move select="Swing Right" scaleX=".5" scaleY=".5"/>
    </path>
  </tam>

  <tam title="3/4 Mix" from="Right-Hand Diamonds" formation="Diamonds RH Girl Points" parts="4.5;4">
    <path>
      <move select="Cast Right"/>
      <move select="Run Right" beats="4" scaleY="2"/>
    </path>
    <path>
      <move select="Stand" beats="4.5"/>
      <move select="Dodge Right" beats="4"/>
      <move select="Swing Right"/>
    </path>
    <path>
      <move select="Cast Right"/>
      <move select="Run Right" beats="4" scaleY="2"/>
    </path>
    <path>
      <move select="Stand" beats="4.5"/>
      <move select="Dodge Right" beats="4"/>
      <move select="Swing Right"/>
    </path>
  </tam>

  <tam title="3/4 Mix" from="Alamo Ring" formation="Alamo Wave" parts="4.5;4">
    <path>
      <move select="Sxtnth Left" />
      <move select="Cast Right"/>
      <move select="Dodge Right" beats="4" scaleY="1.25"/>
      <move select="Swing Right"/>
    </path>
    <path>
      <move select="Sxtnth Right" />
      <move select="Cast Right"/>
      <move select="Run Left" beats="4" scaleY="2.25"/>
    </path>
    <path>
      <move select="Sxtnth Left" />
      <move select="Cast Right"/>
      <move select="Dodge Right" beats="4" scaleY="1.25"/>
      <move select="Swing Right"/>
    </path>
    <path>
      <move select="Sxtnth Right" />
      <move select="Cast Right"/>
      <move select="Run Left" beats="4" scaleY="2.25"/>
    </path>
  </tam>

</tamination>
