<?xml version="1.0"?>
<!DOCTYPE tamination SYSTEM "../tamination.dtd">
<!--

    Copyright 2012 Brad Christie

    This file is part of TAMinations.

    TAMinations is free software: you can redistribute it and/or modify
    it under the terms of the GNU Affero General Public License as published
    by the Free Software Foundation, either version 3 of the License, or
    (at your option) any later version.

    TAMinations is distributed in the hope that it will be useful,
    but WITHOUT ANY WARRANTY; without even the implied warranty of
    MERCHANTABILITY or FITNESS FOR A PARTICULAR PURPOSE.  See the
    GNU Affero General Public License for more details.

    You should have received a copy of the GNU Affero General Public License
    along with TAMinations.  If not, see <http://www.gnu.org/licenses/>.

-->
<tamination>
  
  
  
  

  <tam title="Do Paso"
       from="Static Square"
       formation="Static Square">
    <path>
      <move select="Quarter Right" />
      <move select="Extend Right" scaleY=".75" />
      <move select="Swing Left" scaleX=".75" scaleY=".75" />
      <move select="Extend Left" beats="2" scaleX="2" scaleY=".75" />
      <move select="Swing Right" scaleX=".75" scaleY=".75" />
      <move select="U-Turn Left" beats="3" offsetX="2" offsetY="-2.25" />
      <move select="Beau Wheel" scaleX=".75" scaleY=".75" />
      <move select="BackHinge Right" scaleY=".75" />
    </path>
    <path>
      <move select="Quarter Left" />
      <move select="Extend Right" scaleY=".75" />
      <move select="Swing Left" scaleX=".75" scaleY=".75" />
      <move select="Lead Left" beats="2" scaleX="1.5" scaleY="1.75" />
      <move select="Swing Right" scaleX=".75" scaleY=".75" />
      <move select="Lead Right" beats="3" scaleX=".25" scaleY="3" />
      <move select="Belle Wheel" scaleX=".75" scaleY=".75" />
      <move select="Hinge Left" scaleY=".75" />
    </path>
    <path>
      <move select="Quarter Right" />
      <move select="Extend Right" scaleY=".75" />
      <move select="Swing Left" scaleX=".75" scaleY=".75" />
      <move select="Extend Left" beats="2" scaleX="2" scaleY=".75" />
      <move select="Swing Right" scaleX=".75" scaleY=".75" />
      <move select="U-Turn Left" beats="3" offsetX="2" offsetY="-2.25" />
      <move select="Beau Wheel" scaleX=".75" scaleY=".75" />
      <move select="BackHinge Right" scaleY=".75" />
    </path>
    <path>
      <move select="Quarter Left" />
      <move select="Extend Right" scaleY=".75" />
      <move select="Swing Left" scaleX=".75" scaleY=".75" />
      <move select="Lead Left" beats="2" scaleX="1.5" scaleY="1.75" />
      <move select="Swing Right" scaleX=".75" scaleY=".75" />
      <move select="Lead Right" beats="3" scaleX=".25" scaleY="3" />
      <move select="Belle Wheel" scaleX=".75" scaleY=".75" />
      <move select="Hinge Left" scaleY=".75" />
    </path>
  </tam>
</tamination>
