<?xml version="1.0"?>
<!DOCTYPE tamination SYSTEM "../tamination.dtd">
<!--

    Copyright 2012 Brad Christie

    This file is part of TAMinations.

    TAMinations is free software: you can redistribute it and/or modify
    it under the terms of the GNU Affero General Public License as published
    by the Free Software Foundation, either version 3 of the License, or
    (at your option) any later version.

    TAMinations is distributed in the hope that it will be useful,
    but WITHOUT ANY WARRANTY; without even the implied warranty of
    MERCHANTABILITY or FITNESS FOR A PARTICULAR PURPOSE.  See the
    GNU Affero General Public License for more details.

    You should have received a copy of the GNU Affero General Public License
    along with TAMinations.  If not, see <http://www.gnu.org/licenses/>.

-->
<tamination>

  <tam title="Eight by Swap Around" from="Lines" formation="Normal Lines" group=" ">
  <path>
    <move select="Extend Left" beats="2" scaleX="2" scaleY=".5"/>
    <move select="Lead Right" beats="3" scaleX="2.5" scaleY="2.5"/>
    <move select="Quarter Left" offsetX="1"/>
    <move select="Quarter Left"/>
    <move select="BackHinge Right" scaleY=".5"/>
    <move select="Quarter Left"/>
  </path>
  <path>
    <move select="Flip Right" offsetX="1"/>
  </path>
  <path>
    <move select="Forward 3"/>
  </path>
  <path>
    <move select="Extend Left" beats="2" scaleX="2" scaleY=".5"/>
    <move select="Lead Left" beats="4.5" scaleX="3.5" scaleY="2.5"/>
    <move select="Hinge Left" beats="3" scaleY=".5"/>
    <move select="Quarter Left"/>
  </path>
  </tam>

</tamination>
