<?xml version="1.0"?>
<!DOCTYPE tamination SYSTEM "../tamination.dtd">
<!--

    Copyright 2012 Brad Christie

    This file is part of TAMinations.

    TAMinations is free software: you can redistribute it and/or modify
    it under the terms of the GNU Affero General Public License as published
    by the Free Software Foundation, either version 3 of the License, or
    (at your option) any later version.

    TAMinations is distributed in the hope that it will be useful,
    but WITHOUT ANY WARRANTY; without even the implied warranty of
    MERCHANTABILITY or FITNESS FOR A PARTICULAR PURPOSE.  See the
    GNU Affero General Public License for more details.

    You should have received a copy of the GNU Affero General Public License
    along with TAMinations.  If not, see <http://www.gnu.org/licenses/>.

-->
<tamination>

  <tam title="Invert the Column" from="Right-Hand Columns"
       formation="Column RH GBGB" parts="5;3;3">
    <path numbers="2 7">
      <move select="Run Left" offsetX="-1"/>
      <move select="Forward 2"/>
      <move select="Forward" beats="3"/>
      <move select="Forward" beats="3"/>
      <move select="Extend Left" beats="3" scaleY="2"/>
    </path>
    <path numbers="4 5">
      <move select="Forward" beats="5"/>
      <move select="Run Left" offsetX="-1"/>
      <move select="Forward" beats="3"/>
      <move select="Extend Left" beats="3" scaleY="2"/>
    </path>
    <path numbers="6 3">
      <move select="Forward" beats="5"/>
      <move select="Forward" beats="3"/>
      <move select="Run Left" offsetX="1"/>
      <move select="Extend Left" beats="3" scaleY="2"/>
    </path>
    <path numbers="8 1">
      <move select="Forward" beats="5"/>
      <move select="Forward" beats="3"/>
      <move select="Forward" beats="3"/>
      <move select="U-Turn Left" beats="3" offsetX="3"/>
    </path>
  </tam>


</tamination>
