<?xml version="1.0"?>
<!DOCTYPE tamination SYSTEM "../tamination.dtd">
<!--

    Copyright 2012 Brad Christie

    This file is part of TAMinations.

    TAMinations is free software: you can redistribute it and/or modify
    it under the terms of the GNU Affero General Public License as published
    by the Free Software Foundation, either version 3 of the License, or
    (at your option) any later version.

    TAMinations is distributed in the hope that it will be useful,
    but WITHOUT ANY WARRANTY; without even the implied warranty of
    MERCHANTABILITY or FITNESS FOR A PARTICULAR PURPOSE.  See the
    GNU Affero General Public License for more details.

    You should have received a copy of the GNU Affero General Public License
    along with TAMinations.  If not, see <http://www.gnu.org/licenses/>.

-->
<tamination>
  
  

  <tam title="Team Up" from="Completed Double Pass Thru" formation="Completed Double Pass Thru">
    <path>
      <move select="Quarter Left" offsetY="1"/>
      <move select="Quarter Right" beats="1.5" hands="right" offsetX="1"/>
    </path>
    <path>
      <move select="Lead Right"/>
      <move select="Hinge Right"/>
    </path>
    <path>
      <move select="Dodge Left"/>
    </path>
    <path>
      <move select="Run Right"/>
    </path>
  </tam>

</tamination>
